{
  "report_version": "1.0",
  "scope": "visual-validation",
  "template": {
    "id": "single-insight-v1",
    "version": "1.0.0"
  },
  "content_id": "insight-long-body",
  "status": "fail",
  "canvas": {
    "expected": {
      "width": 1200,
      "height": 627
    },
    "actual": {
      "width": 1200,
      "height": 627
    }
  },
  "checks": {
    "input_contract": "pass",
    "required_fields": "pass",
    "assets": "pass",
    "canvas": "pass",
    "content_present": "pass",
    "overflow": "fail",
    "approved_text_preserved": "pass",
    "safe_binding": "pass"
  },
  "failures": [
    {
      "code": "BODY_OVERFLOW",
      "check": "overflow",
      "slot": "body",
      "message": "Body overflows its region: 163.5px taller than its region; extends past the canvas edge",
      "details": {
        "lines": 14,
        "max_lines": null,
        "overflow_bottom_px": 163.5,
        "overflow_right_px": 0
      }
    }
  ],
  "layout": {
    "brand": {
      "lines": null,
      "max_lines": null,
      "content_box": {
        "x": 932,
        "y": 563,
        "width": 222,
        "height": 32
      },
      "region_box": {
        "x": 932,
        "y": 32,
        "width": 236,
        "height": 563
      },
      "overflow_bottom_px": 0,
      "overflow_right_px": -14,
      "ink_ratio": 0.3946
    },
    "title": {
      "lines": 2,
      "max_lines": 3,
      "content_box": {
        "x": 48,
        "y": 48,
        "width": 804,
        "height": 104
      },
      "region_box": {
        "x": 48,
        "y": 48,
        "width": 804,
        "height": 104
      },
      "overflow_bottom_px": 0,
      "overflow_right_px": 0,
      "ink_ratio": 0.2807
    },
    "body": {
      "lines": 14,
      "max_lines": null,
      "content_box": {
        "x": 48,
        "y": 176,
        "width": 804,
        "height": 476
      },
      "region_box": {
        "x": 48,
        "y": 176,
        "width": 804,
        "height": 312.5
      },
      "overflow_bottom_px": 163.5,
      "overflow_right_px": 0,
      "ink_ratio": 0.0906
    },
    "source_note": {
      "lines": 1,
      "max_lines": 2,
      "content_box": {
        "x": 48,
        "y": 557,
        "width": 804,
        "height": 22
      },
      "region_box": {
        "x": 48,
        "y": 557,
        "width": 804,
        "height": 22
      },
      "overflow_bottom_px": 0,
      "overflow_right_px": 0,
      "ink_ratio": 0.2572
    }
  },
  "security": {
    "page_javascript_enabled": false,
    "blocked_requests": [],
    "csp_violations": [],
    "dialogs": 0,
    "page_errors": []
  },
  "assets": [
    {
      "role": "template",
      "path": "src/task-7_sahil-vashisht/template/single-insight-v1.html",
      "exists": true,
      "sha256": "a41036cb669ab6d201e858dfe1d4d75280c6b0f25dc3dbad1d5230b3bda2c565",
      "loaded": true
    },
    {
      "role": "template-stylesheet",
      "path": "src/task-7_sahil-vashisht/template/single-insight-v1.css",
      "exists": true,
      "sha256": "5940aafef4ca17806ebd77020b6190f7ec5850514c743302d63a919026f840f3",
      "loaded": true
    },
    {
      "role": "design-stylesheet",
      "path": "design/atomity.css",
      "exists": true,
      "sha256": "0c5f885729fb6999dee511c4de4c48a24cb67400902873d353e21c5b950d485e",
      "loaded": true
    },
    {
      "role": "logo",
      "path": "design/atomity_logo.svg",
      "exists": true,
      "sha256": "64b3cca825385d29c3ca8c5d1813eb9adab401e179b664b6d9e9e27ecb470041",
      "loaded": true
    },
    {
      "role": "font",
      "path": "design/fonts/GoogleSansFlex-VariableFont_GRAD,ROND,opsz,slnt,wdth,wght.ttf",
      "exists": true,
      "sha256": "c6d53424121196b81de816b8daccf200e285dd506df43766db3d7e8cdf06ee30",
      "loaded": true
    },
    {
      "role": "font",
      "path": "design/fonts/GoogleSansCode-VariableFont_MONO,wght.ttf",
      "exists": true,
      "sha256": "613568cfb7ee42b08d9cb37c87219e32d9a9248cff391f9661b390c92fd9bfcd",
      "loaded": true
    },
    {
      "role": "font",
      "path": "design/fonts/GowunBatang-Regular.ttf",
      "exists": true,
      "sha256": "8bc1faf7965c79cd23cc21bea5be0a0582ba6804d33f00e50f3bb27ed10965d0",
      "loaded": true
    }
  ],
  "inputs": {
    "content_file": "src/task-7_sahil-vashisht/fixtures/long-body.json",
    "content_file_sha256": "97f80a90a27f342aa4ade56d5ee9639353688e6b50b7f160fc5eb0584ca08733",
    "approval_digest_recorded": "6438a26d01bcc451928f77dea4c88a712aaa588a06b04078999962a6891eb331",
    "approval_digest_computed": "6438a26d01bcc451928f77dea4c88a712aaa588a06b04078999962a6891eb331",
    "design_config_file": "src/task-7_sahil-vashisht/config/single-insight-v1.design.json",
    "design_config_sha256": "8f3045155c05c3aee055dd37a4861d094965bc2d8175f0131a9d610c70c5ec9c"
  },
  "outputs": {
    "png": "insight.failed.png",
    "png_sha256": "06ea2b95397bee257101eb273bc6f6f7047fb94a6c5a48052c7e47ba2135be5b",
    "html": "insight.html"
  },
  "renderer": {
    "engine": "chromium",
    "browser_version": "156.0.8078.4",
    "viewport": {
      "width": 1200,
      "height": 627
    },
    "device_scale_factor": 1
  }
}
